{
  "$schema": "https://json-schema.org/draft/2020-12/schema",
  "$id": "https://rhi.zone/software-taxonomy/schema/predicate.schema.json",
  "title": "Predicate",
  "type": "object",
  "required": ["id", "label", "description", "lens", "value_type"],
  "additionalProperties": false,
  "properties": {
    "id": {
      "type": "string",
      "pattern": "^[a-z][a-z0-9_]*$",
      "description": "Unique predicate id in snake_case."
    },
    "label": {
      "type": "string",
      "description": "Human-readable predicate label."
    },
    "description": {
      "type": "string",
      "description": "What this predicate means and when to use it."
    },
    "lens": {
      "type": "string",
      "description": "The lens that owns and defines this predicate."
    },
    "value_type": {
      "type": "string",
      "enum": ["string", "integer", "boolean", "date", "url", "entity", "language_string"],
      "description": "Type of the statement value."
    },
    "value_pattern": {
      "type": "string",
      "description": "Regex the value must match (for value_type=string or date)."
    },
    "domain": {
      "oneOf": [
        {"type": "array", "items": {"type": "string"}},
        {"type": "null"}
      ],
      "description": "Entity class ids (prefixed with @) that the subject must be an instance_of (transitively). Null = no constraint."
    },
    "range": {
      "oneOf": [
        {"type": "array", "items": {"type": "string"}},
        {"type": "null"}
      ],
      "description": "Entity class ids (prefixed with @) that the value must be an instance_of (transitively), when value_type=entity. Null = no constraint."
    },
    "cardinality": {
      "type": "string",
      "pattern": "^\\d+\\.\\.(\\d+|\\*)$",
      "description": "Cardinality constraint in the form 'min..max' where max can be * for unlimited."
    },
    "inverse": {
      "type": "string",
      "description": "Id of the inverse predicate, if one exists."
    },
    "transitive": {
      "type": "boolean",
      "description": "Whether this predicate chains transitively (default false)."
    },
    "deprecated": {
      "type": "boolean",
      "description": "When true, using this predicate emits a validator warning. Document the successor in description."
    },
    "alias_of": {
      "oneOf": [
        {"type": "string"},
        {"type": "null"}
      ],
      "description": "Id of the canonical predicate this one aliases. Validator resolves constraints from the canonical."
    },
    "since_version": {
      "type": "string",
      "description": "Free-form version tag recording when this predicate was introduced. Pure metadata."
    }
  }
}
