{
  "id": "@core:version_of",
  "label": "version of",
  "description": "Asserts this entity is a specific version or release of a parent entity. Use for @ms-word-2007 version_of @ms-word.",
  "lens": "core",
  "value_type": "entity",
  "domain": [
    "@class:technical-artifact"
  ],
  "range": [
    "@class:technical-artifact"
  ],
  "cardinality": "0..1",
  "inverse": "@core:has_version"
}
