{
  "id": "@core:depends_on",
  "label": "depends on",
  "description": "A runtime or build-time dependency of this entity. Use for libraries, runtimes, or platforms required for the entity to function.",
  "lens": "core",
  "value_type": "entity",
  "domain": [
    "@class:software"
  ],
  "range": [
    "@class:software"
  ],
  "cardinality": "0..*",
  "inverse": "@core:dependency_of"
}
