{
  "id": "@core:dependency_of",
  "label": "dependency of",
  "description": "Inverse of depends_on. This entity is a dependency of the subject.",
  "lens": "core",
  "value_type": "entity",
  "domain": [
    "@class:software"
  ],
  "range": [
    "@class:software"
  ],
  "cardinality": "0..*",
  "inverse": "@core:depends_on"
}
