{
  "id": "@biology:inspired",
  "label": "inspired",
  "description": "Inverse of inspired_by. This entity inspired another.",
  "lens": "biology",
  "value_type": "entity",
  "domain": [
    "@class:software"
  ],
  "range": [
    "@class:software"
  ],
  "cardinality": "0..*",
  "inverse": "@biology:inspired_by"
}
